{
  "episode_id": "episode_000000_fit_context_budget",
  "world_id": "scarlet_letter_reputation_spiral",
  "model_tier": "9B_Q4",
  "context_budget_tokens": 8192,
  "objective": "fit_context_budget",
  "initial_metrics": {
    "authoring_score": 0.5949,
    "ending_entropy": 0.3889,
    "pvalue_alignment": 0.1924,
    "validator_errors": 0.8889
  },
  "steps": [
    {
      "step_index": 0,
      "role_id": "mcp_context_router",
      "state_ref": "a7d3073744d89feb",
      "chosen_action": "SHRINK_CONTEXT",
      "llm_call_type": "none",
      "context_packet_ref": "mcp_packet_0000_00",
      "output_ref": "trajectory_output_a7d3073744d89feb",
      "verifier_delta_ref": "verifier_delta_0000_00",
      "accepted": true,
      "failure_mode": "context_overflow"
    },
    {
      "step_index": 1,
      "role_id": "world_state_summarizer",
      "state_ref": "2c985b30dde075f9",
      "chosen_action": "BUILD_STATE_CARD",
      "llm_call_type": "none",
      "context_packet_ref": "mcp_packet_0000_01",
      "output_ref": "trajectory_output_2c985b30dde075f9",
      "verifier_delta_ref": "verifier_delta_0000_01",
      "accepted": true,
      "failure_mode": "no_metric_delta"
    },
    {
      "step_index": 2,
      "role_id": "llm_prompt_composer",
      "state_ref": "a59209697c347e2d",
      "chosen_action": "ASK_LLM_BOUNDED_DRAFT",
      "llm_call_type": "bounded_draft",
      "context_packet_ref": "mcp_packet_0000_02",
      "output_ref": "trajectory_output_a59209697c347e2d",
      "verifier_delta_ref": "verifier_delta_0000_02",
      "accepted": true,
      "failure_mode": "missing_p2value_refs"
    },
    {
      "step_index": 3,
      "role_id": "option_manifold_planner",
      "state_ref": "39b4713d2c862222",
      "chosen_action": "ASK_LLM_OPTION_SET",
      "llm_call_type": "option_set",
      "context_packet_ref": "mcp_packet_0000_03",
      "output_ref": "trajectory_output_39b4713d2c862222",
      "verifier_delta_ref": "verifier_delta_0000_03",
      "accepted": true,
      "failure_mode": "schema_parse_error"
    },
    {
      "step_index": 4,
      "role_id": "reaction_dynamics_mapper",
      "state_ref": "4e63d483693cbe5e",
      "chosen_action": "ASK_LLM_REACTION_TEXT",
      "llm_call_type": "reaction_text",
      "context_packet_ref": "mcp_packet_0000_04",
      "output_ref": "trajectory_output_4e63d483693cbe5e",
      "verifier_delta_ref": "verifier_delta_0000_04",
      "accepted": true,
      "failure_mode": "dangling_consequence"
    },
    {
      "step_index": 5,
      "role_id": "effect_script_synthesizer",
      "state_ref": "159213bd77125379",
      "chosen_action": "SYNTHESIZE_EFFECT_SCRIPT",
      "llm_call_type": "none",
      "context_packet_ref": "mcp_packet_0000_05",
      "output_ref": "trajectory_output_159213bd77125379",
      "verifier_delta_ref": "verifier_delta_0000_05",
      "accepted": true,
      "failure_mode": "unreachable_secret"
    },
    {
      "step_index": 6,
      "role_id": "gate_secret_route_designer",
      "state_ref": "7ad883d6c133aed5",
      "chosen_action": "DESIGN_GATE_THRESHOLDS",
      "llm_call_type": "none",
      "context_packet_ref": "mcp_packet_0000_06",
      "output_ref": "trajectory_output_7ad883d6c133aed5",
      "verifier_delta_ref": "verifier_delta_0000_06",
      "accepted": true,
      "failure_mode": "dominant_fallback_ending"
    },
    {
      "step_index": 7,
      "role_id": "validator_repair_critic",
      "state_ref": "e1927b7dc19b5fc4",
      "chosen_action": "SELECT_REPAIR_TARGET",
      "llm_call_type": "none",
      "context_packet_ref": "mcp_packet_0000_07",
      "output_ref": "trajectory_output_e1927b7dc19b5fc4",
      "verifier_delta_ref": "verifier_delta_0000_07",
      "accepted": true,
      "failure_mode": "missing_pvalue_refs"
    },
    {
      "step_index": 8,
      "role_id": "commit_veto_controller",
      "state_ref": "e23d57efb83c8fd7",
      "chosen_action": "COMMIT_PATCH",
      "llm_call_type": "none",
      "context_packet_ref": "mcp_packet_0000_08",
      "output_ref": "trajectory_output_e23d57efb83c8fd7",
      "verifier_delta_ref": "verifier_delta_0000_08",
      "accepted": true,
      "failure_mode": "insufficient_neighbor_context"
    }
  ],
  "final_metrics": {
    "authoring_score": 0.6286,
    "ending_entropy": 0.4377,
    "pvalue_alignment": 0.2618,
    "validator_errors": 0.3333
  },
  "episode_label": {
    "success": false,
    "best_next_role": "mcp_context_router",
    "failure_class": "context_overflow",
    "reward": 0.2
  }
}
